{
  "activation": {
    "reasonCodes": [
      "UPSTREAM_VERIFICATION_PENDING",
      "DESTINATION_MIRROR_PROOF_MISSING",
      "LAB_SIGNATURE_MISSING",
      "STORAGE_CLASS_REFERENCE_UNRESOLVED",
      "DEPENDENCY_SECRET_REFERENCES_UNRESOLVED",
      "DEPENDENCY_TLS_REFERENCES_UNRESOLVED",
      "MODEL_PVC_MATERIALIZATION_PROOF_MISSING",
      "LIVE_ALLOCATABLE_NOT_OBSERVED",
      "OPENSHIFT_SERVER_SIDE_DRY_RUN_MISSING",
      "LIVE_DEPENDENCY_CONNECTIVITY_MISSING"
    ],
    "state": "blocked"
  },
  "architecture": "linux/amd64",
  "bindings": {
    "dependencyArtifactSetDigest": "sha256:b59db076514f87b1251d069e5637badc21940aaf9cb729f49ab17f0058b4a46e",
    "runtimeContractSetDigest": "sha256:927aede7b9994cc2f7dca69ca5cf29d7e096d0bcd6b32b938d431b91c9f712b6",
    "workloadCandidateDigest": "sha256:03427f83b8131b515e93733524d4f31a857ccba411ab0ca9144f9eda19073f81"
  },
  "candidateDigest": "sha256:469823412c063f67a8b0e30bb8b6b8be3a0cbec50e9755b409efd06174a5f531",
  "candidateId": "orchestra-sno-trial-dependency-manifests-2026-07-28.3",
  "claims": {
    "campaignEvidence": false,
    "contractualSla": false,
    "customerCertified": false,
    "highAvailability": false,
    "productionSupported": false,
    "redHatCertified": false,
    "referenceProfileVerified": false,
    "rpoRtoVerified": false
  },
  "controls": {
    "activeKustomizationReferenced": false,
    "allowedCertificationSlots": [],
    "argocdApplicationsEmitted": false,
    "campaignEligible": false,
    "cloudMutationAuthorized": false,
    "deploymentAuthorized": false,
    "manifestsEmitted": true,
    "modelBytesStored": false,
    "operatorMaterializationRequired": true,
    "productionDependencyProfileMutated": false,
    "renderable": true,
    "runtimeModelDownloadAllowed": false,
    "scope": "sno-engineering-trial-valkey-and-model-backend-only",
    "secretObjectsEmitted": false,
    "secretValuesStored": false,
    "sourceOnly": true,
    "workloadCandidateMutated": false
  },
  "executionMode": "source-only",
  "kind": "orchestra.openshift.sno-trial-dependency-manifest-candidate.v1",
  "kustomization": "gitops/dependencies/candidates/sno-trial/kustomization.yaml",
  "manifestRoot": "gitops/dependencies/candidates/sno-trial",
  "manifestSetDigest": "sha256:e5255df5ccebaa1fb25347be194770a92a080dca9ef23c94b082cf1ac9bff728",
  "profileId": "orchestra-ocp-sno-trial-amd64-v1",
  "requiredInputs": [
    {
      "id": "storage-class",
      "kind": "StorageClass",
      "materialization": "replace-with-live-observed-name",
      "name": "ORCHESTRA_SNO_STORAGE_CLASS_REQUIRED",
      "namespace": null,
      "requiredKeys": [],
      "usage": "valkey-volume-claim-template"
    },
    {
      "id": "valkey-auth",
      "kind": "Secret",
      "materialization": "operator-created-out-of-band",
      "name": "orchestra-sno-valkey-auth",
      "namespace": "orchestra-sno-valkey",
      "requiredKeys": [
        "password"
      ],
      "usage": "valkey-server-and-probe-authentication"
    },
    {
      "id": "valkey-server-tls",
      "kind": "Secret",
      "materialization": "operator-created-out-of-band",
      "name": "orchestra-sno-valkey-server-tls",
      "namespace": "orchestra-sno-valkey",
      "requiredKeys": [
        "ca.crt",
        "tls.crt",
        "tls.key"
      ],
      "usage": "valkey-server-tls"
    },
    {
      "id": "model-artifact-pvc",
      "kind": "PersistentVolumeClaim",
      "materialization": "operator-prestaged-and-digest-verified",
      "name": "orchestra-sno-model-artifact",
      "namespace": "orchestra-sno-model-backend",
      "requiredKeys": [],
      "usage": "read-only-pinned-gguf"
    },
    {
      "id": "model-auth",
      "kind": "Secret",
      "materialization": "operator-created-out-of-band",
      "name": "orchestra-sno-model-auth",
      "namespace": "orchestra-sno-model-backend",
      "requiredKeys": [
        "api-keys"
      ],
      "usage": "llama-server-api-key-file"
    },
    {
      "id": "model-server-tls",
      "kind": "Secret",
      "materialization": "operator-created-out-of-band",
      "name": "orchestra-sno-model-server-tls",
      "namespace": "orchestra-sno-model-backend",
      "requiredKeys": [
        "ca.crt",
        "tls.crt",
        "tls.key"
      ],
      "usage": "llama-server-tls"
    }
  ],
  "resourceFiles": [
    "namespace-valkey.json",
    "namespace-model-backend.json",
    "valkey-service-account.json",
    "valkey-service.json",
    "valkey-stateful-set.json",
    "valkey-default-deny.json",
    "valkey-allow-clients.json",
    "model-backend-service-account.json",
    "model-backend-service.json",
    "model-backend-stateful-set.json",
    "model-backend-default-deny.json",
    "model-backend-allow-model-plane.json"
  ],
  "resourceInventory": [
    {
      "apiVersion": "v1",
      "kind": "Namespace",
      "name": "orchestra-sno-valkey",
      "namespace": null
    },
    {
      "apiVersion": "v1",
      "kind": "Namespace",
      "name": "orchestra-sno-model-backend",
      "namespace": null
    },
    {
      "apiVersion": "v1",
      "kind": "ServiceAccount",
      "name": "orchestra-sno-valkey",
      "namespace": "orchestra-sno-valkey"
    },
    {
      "apiVersion": "v1",
      "kind": "Service",
      "name": "orchestra-sno-valkey",
      "namespace": "orchestra-sno-valkey"
    },
    {
      "apiVersion": "apps/v1",
      "kind": "StatefulSet",
      "name": "orchestra-sno-valkey",
      "namespace": "orchestra-sno-valkey"
    },
    {
      "apiVersion": "networking.k8s.io/v1",
      "kind": "NetworkPolicy",
      "name": "default-deny",
      "namespace": "orchestra-sno-valkey"
    },
    {
      "apiVersion": "networking.k8s.io/v1",
      "kind": "NetworkPolicy",
      "name": "allow-valkey-clients",
      "namespace": "orchestra-sno-valkey"
    },
    {
      "apiVersion": "v1",
      "kind": "ServiceAccount",
      "name": "orchestra-sno-model-backend",
      "namespace": "orchestra-sno-model-backend"
    },
    {
      "apiVersion": "v1",
      "kind": "Service",
      "name": "orchestra-sno-model-backend",
      "namespace": "orchestra-sno-model-backend"
    },
    {
      "apiVersion": "apps/v1",
      "kind": "StatefulSet",
      "name": "orchestra-sno-model-backend",
      "namespace": "orchestra-sno-model-backend"
    },
    {
      "apiVersion": "networking.k8s.io/v1",
      "kind": "NetworkPolicy",
      "name": "default-deny",
      "namespace": "orchestra-sno-model-backend"
    },
    {
      "apiVersion": "networking.k8s.io/v1",
      "kind": "NetworkPolicy",
      "name": "allow-model-plane",
      "namespace": "orchestra-sno-model-backend"
    }
  ],
  "schemaVersion": 1,
  "targetClass": "engineering-trial",
  "workloads": [
    {
      "allowedClientNamespaces": [
        "orchestra-platform",
        "orchestra-model"
      ],
      "container": "valkey",
      "id": "valkey",
      "image": "docker.io/valkey/valkey@sha256:64f6e8025b9a798061c8c79e73a7a79dbc8cca437e6af682e9f7605ff334615d",
      "modelArtifactReadOnly": null,
      "namespace": "orchestra-sno-valkey",
      "persistentVolumeGiB": 2,
      "port": 6379,
      "protocol": "valkey-tls",
      "replicas": 1,
      "service": "orchestra-sno-valkey",
      "serviceAccount": "orchestra-sno-valkey",
      "statefulSet": "orchestra-sno-valkey"
    },
    {
      "allowedClientNamespaces": [
        "orchestra-model"
      ],
      "container": "model-backend",
      "id": "model-backend",
      "image": "ghcr.io/ggml-org/llama.cpp@sha256:7a670b0633a2b33d915ca958fc1e4977334924590c9bd5ffc9d4813dd168d77b",
      "modelArtifactReadOnly": true,
      "namespace": "orchestra-sno-model-backend",
      "persistentVolumeGiB": 10,
      "port": 8000,
      "protocol": "openai-compatible-https",
      "replicas": 1,
      "service": "orchestra-sno-model-backend",
      "serviceAccount": "orchestra-sno-model-backend",
      "statefulSet": "orchestra-sno-model-backend"
    }
  ]
}
